{
  "$schema": "../../../../../../../../schema/v1/json/autolabels.schema.json",
  "schemaVersion": 1,
  "kind": "autolabels",
  "id": "silverleaf-chapter-0001-v0001-autolabels-cluener-default",
  "producer": {
    "name": "cluener",
    "config": "cluener-default"
  },
  "labels": [
    {
      "start": 9,
      "end": 12,
      "text": "银叶湖",
      "entityGroup": "scene",
      "score": 0.5733996033668518
    },
    {
      "start": 30,
      "end": 32,
      "text": "蕾娜",
      "entityGroup": "name",
      "score": 0.8622729778289795
    },
    {
      "start": 93,
      "end": 97,
      "text": "暗影教廷",
      "entityGroup": "organization",
      "score": 0.4897865653038025
    },
    {
      "start": 106,
      "end": 108,
      "text": "银叶",
      "entityGroup": "address",
      "score": 0.6446828842163086
    },
    {
      "start": 110,
      "end": 112,
      "text": "族长",
      "entityGroup": "position",
      "score": 0.7360259890556335
    },
    {
      "start": 112,
      "end": 115,
      "text": "艾尔隆",
      "entityGroup": "name",
      "score": 0.9791565537452698
    },
    {
      "start": 220,
      "end": 222,
      "text": "蕾娜",
      "entityGroup": "name",
      "score": 0.8684546947479248
    },
    {
      "start": 298,
      "end": 301,
      "text": "洛瑟琳",
      "entityGroup": "name",
      "score": 0.9105391502380371
    },
    {
      "start": 321,
      "end": 325,
      "text": "暗影教廷",
      "entityGroup": "organization",
      "score": 0.6534482836723328
    },
    {
      "start": 328,
      "end": 330,
      "text": "教皇",
      "entityGroup": "position",
      "score": 0.9086788892745972
    },
    {
      "start": 352,
      "end": 353,
      "text": "娜",
      "entityGroup": "name",
      "score": 0.5455722212791443
    },
    {
      "start": 364,
      "end": 367,
      "text": "洛瑟琳",
      "entityGroup": "name",
      "score": 0.7826235890388489
    },
    {
      "start": 397,
      "end": 399,
      "text": "蕾娜",
      "entityGroup": "name",
      "score": 0.5809149742126465
    }
  ],
  "errors": []
}
