{
  "$schema": "../../../../../../../../schema/v1/json/autolabels.schema.json",
  "schemaVersion": 1,
  "kind": "autolabels",
  "id": "xianxia-source-chapter-0001-v0002-cluener-output",
  "producer": {
    "name": "cluener",
    "config": "cluener-default"
  },
  "labels": [
    {
      "start": 3,
      "end": 5,
      "text": "林安",
      "entityGroup": "person",
      "score": 0.99
    },
    {
      "start": 7,
      "end": 10,
      "text": "青石城",
      "entityGroup": "location",
      "score": 0.98
    }
  ],
  "errors": []
}
